accept_type,author_list,filename,majority_authors_from_india,paper_content,paper_id,paper_title,pdf_url,top_author_from_india
poster,"[{'name': 'Shashwat Singh', 'openreview_id': '~Shashwat_Singh1', 'affiliation_name': 'International Institute of Information Technology Hyderabad', 'affiliation_domain': 'iiit.ac.in', 'affiliation_country': 'IN'}, {'name': '', 'openreview_id': '~Shauli_Ravfogel1', 'affiliation_name': 'Bar-Ilan University', 'affiliation_domain': 'biu.ac.il', 'affiliation_country': 'IL'}, {'name': 'Jonathan Herzig', 'openreview_id': '~Jonathan_Herzig2', 'affiliation_name': 'Research, Google', 'affiliation_domain': 'research.google.com', 'affiliation_country': 'US'}, {'name': 'Roee Aharoni', 'openreview_id': '~Roee_Aharoni1', 'affiliation_name': 'Google', 'affiliation_domain': 'google.com', 'affiliation_country': 'US'}, {'name': 'Ryan Cotterell', 'openreview_id': '~Ryan_Cotterell1', 'affiliation_name': 'Swiss Federal Institute of Technology', 'affiliation_domain': 'ethz.ch', 'affiliation_country': 'CH'}, {'name': 'Ponnurangam Kumaraguru', 'openreview_id': '~Ponnurangam_Kumaraguru3', 'affiliation_name': 'International Institute of Information Technology Hyderabad ', 'affiliation_domain': 'iiit.ac.in', 'affiliation_country': 'IN'}]",ui/indiaml-tracker/public/tracker/icml-2024.json,False,"This paper develops a theoretical framework and practical methods for ""steering"" neural language model representations to reduce undesirable behaviors, such as generating toxic or biased text.  Specifically, it derives optimal affine steering functions to modify model representations, providing justification for existing techniques and proposing an improved approach.  Empirical experiments demonstrate the effectiveness of these methods in mitigating biases and reducing toxic content generation.
",GwA4go0Mw4,Representation Surgery: Theory and Practice of Affine Steering,https://openreview.net/pdf/b913a137f582939ceef4f0e95b210de1e8e9e8cc.pdf,True
poster,"[{'name': 'Kirankumar Shiragur', 'openreview_id': '~Kirankumar_Shiragur1', 'affiliation_name': 'Microsoft Research', 'affiliation_domain': 'microsoft.com', 'affiliation_country': 'IN'}, {'name': 'Jiaqi Zhang', 'openreview_id': '~Jiaqi_Zhang2', 'affiliation_name': 'Massachusetts Institute of Technology', 'affiliation_domain': 'mit.edu', 'affiliation_country': 'US'}, {'name': '', 'openreview_id': '~Caroline_Uhler1', 'affiliation_name': 'Electrical Engineering & Computer Science, Massachusetts Institute of Technology', 'affiliation_domain': 'eecs.mit.edu', 'affiliation_country': 'US'}]",ui/indiaml-tracker/public/tracker/icml-2024.json,False,"This paper addresses the computational limitations of existing causal discovery algorithms, which often require an exponential number of conditional independence tests.  It proposes a new method, the Causal Consistent Partition Graph (CCPG), that learns a coarser representation of the causal graph using a polynomial number of tests.  This approach aims to provide an efficient algorithm for recovering the true causal graph in specific cases, particularly when the graph is fully identifiable.
",HpT19AKddu,Causal Discovery with Fewer Conditional Independence Tests,https://openreview.net/pdf/23331b236f09db1c4293895ed7d92c5d7c76991f.pdf,True
poster,"[{'name': 'Pravendra Singh', 'openreview_id': '~Pravendra_Singh1', 'affiliation_name': 'Indian Institute of Technology, Roorkee', 'affiliation_domain': 'iitr.ac.in', 'affiliation_country': 'IN'}]",ui/indiaml-tracker/public/tracker/icml-2024.json,True,"This research paper introduces a novel self-supervised approach, SSWDP, for trajectory prediction.  The goal is to enhance representation learning for improved trajectory prediction accuracy by predicting distortion within observed trajectories.  The authors aim to complement existing methods and demonstrate significant improvements on various benchmark datasets, particularly in environments with distortions.
",OQ7TlOphGX,Enhancing Trajectory Prediction through Self-Supervised Waypoint Distortion Prediction,https://openreview.net/pdf/6f5199a867ae97c4ee3f4303b1afe90f767d9d65.pdf,True
poster,"[{'name': 'Tianjun Zhang', 'openreview_id': '~Tianjun_Zhang1', 'affiliation_name': 'University of California Berkeley', 'affiliation_domain': 'berkeley.edu', 'affiliation_country': 'US'}, {'name': '', 'openreview_id': '~Aman_Madaan1', 'affiliation_name': 'Carnegie Mellon University', 'affiliation_domain': 'cmu.edu', 'affiliation_country': 'US'}, {'name': 'Luyu Gao', 'openreview_id': '~Luyu_Gao1', 'affiliation_name': 'Carnegie Mellon University', 'affiliation_domain': 'cmu.edu', 'affiliation_country': 'US'}, {'name': 'Steven Zheng', 'openreview_id': '~Steven_Zheng1', 'affiliation_name': 'Google', 'affiliation_domain': 'google.com', 'affiliation_country': 'US'}, {'name': 'Swaroop Mishra', 'openreview_id': '~Swaroop_Mishra1', 'affiliation_name': 'Google', 'affiliation_domain': 'google.com', 'affiliation_country': 'US'}, {'name': '', 'openreview_id': '~Yiming_Yang1', 'affiliation_name': 'School of Computer Science, Carnegie Mellon University', 'affiliation_domain': 'cs.cmu.edu', 'affiliation_country': 'US'}, {'name': 'Niket Tandon', 'openreview_id': '~Niket_Tandon2', 'affiliation_name': 'Research, Microsoft', 'affiliation_domain': 'research.microsoft.com', 'affiliation_country': 'IN'}, {'name': 'Uri Alon', 'openreview_id': '~Uri_Alon1', 'affiliation_name': 'Google DeepMind', 'affiliation_domain': 'google.com', 'affiliation_country': 'US'}]",ui/indiaml-tracker/public/tracker/icml-2024.json,False,"This paper introduces LEAP, a method for improving in-context learning (ICL) in large language models (LLMs).  LEAP intentionally induces errors in example input-output pairs, allowing the model to derive task-specific principles for solving similar problems.  These learned principles, combined with the original examples, then enhance the LLM's performance on unseen test data across various benchmarks, including question answering and math problems.
",PAPY0cAB3C,In-Context Principle Learning from Mistakes,https://openreview.net/pdf/2526010313edf53a746ebfa778cf15642b26a62c.pdf,False
poster,"[{'name': 'mohit sharma', 'openreview_id': '~mohit_sharma5', 'affiliation_name': 'Indraprastha Institute of Information Technology, Delhi', 'affiliation_domain': 'iiitd.ac.in', 'affiliation_country': 'IN'}, {'name': 'Amit Deshpande', 'openreview_id': '~Amit_Deshpande1', 'affiliation_name': 'Microsoft Research', 'affiliation_domain': 'microsoft.com', 'affiliation_country': 'US'}]",ui/indiaml-tracker/public/tracker/icml-2024.json,True,"This paper extends previous research on fair classification by demonstrating how fairness constraints can recover accurate and fair classifiers even when the training data is significantly biased.  It generalizes these results to different types of bias, data distributions, and hypothesis classes.  The authors prove that under specific conditions, the optimal fair classifier on biased data equals the optimal classifier on unbiased data, thus suggesting that well-designed fairness constraints can mitigate data bias.
",RfQT6vJt8b,How Far Can Fairness Constraints Help Recover From Biased Data?,https://openreview.net/pdf/409965515edccbc49d377b009df2f47a57479ebd.pdf,True
poster,"[{'name': 'Aishwarya P S', 'openreview_id': '~Aishwarya_P_S1', 'affiliation_name': 'Google', 'affiliation_domain': 'google.com', 'affiliation_country': 'IN'}, {'name': 'Yashas Samaga B L', 'openreview_id': '~Yashas_Samaga_B_L2', 'affiliation_name': 'University of Washington', 'affiliation_domain': 'uw.edu', 'affiliation_country': 'US'}, {'name': 'Toby James Boyd', 'openreview_id': '~Toby_James_Boyd1', 'affiliation_name': 'Unknown', 'affiliation_domain': 'unknown.edu', 'affiliation_country': 'UNK'}, {'name': '', 'openreview_id': '~Sanjiv_Kumar1', 'affiliation_name': 'Google', 'affiliation_domain': 'google.com', 'affiliation_country': 'US'}, {'name': '', 'openreview_id': '~Prateek_Jain1', 'affiliation_name': 'Google', 'affiliation_domain': 'google.com', 'affiliation_country': 'US'}, {'name': '', 'openreview_id': '~Praneeth_Netrapalli1', 'affiliation_name': 'Google', 'affiliation_domain': 'google.com', 'affiliation_country': 'US'}]",ui/indiaml-tracker/public/tracker/icml-2024.json,False,"This paper introduces Tandem Transformers, a novel architecture for large language models (LLMs).  The architecture combines a small, autoregressive model with a larger, block-mode model to accelerate inference.  The goal is to improve inference speed without sacrificing downstream task accuracy by strategically allocating capacity for prompt processing versus response generation.
",TN3fi7dwPo,Tandem Transformers for Inference Efficient LLMs,https://openreview.net/pdf/c14bbb8bb8638326ffae116b81072096457da928.pdf,True
spotlight,"[{'name': 'Aditya Gopalan', 'openreview_id': '~Aditya_Gopalan1', 'affiliation_name': 'Indian Institute of Science', 'affiliation_domain': 'iisc.ac.in', 'affiliation_country': 'IN'}, {'name': 'Venkatesh Saligrama', 'openreview_id': '~Venkatesh_Saligrama1', 'affiliation_name': 'Amazon', 'affiliation_domain': 'amazon.com', 'affiliation_country': 'US'}, {'name': 'Clayton Scott', 'openreview_id': '~Clayton_Scott1', 'affiliation_name': 'University of Michigan', 'affiliation_domain': 'umich.edu', 'affiliation_country': 'US'}]",ui/indiaml-tracker/public/tracker/icml-2024.json,False,"This paper investigates the feasibility testing of linear programs with bandit feedback.  It develops a novel test for determining if a linear program has a feasible solution, based on low-regret algorithms and a non-asymptotic law of iterated logarithms, within a linear bandit setting.  The method is shown to be reliable and adaptive to the signal level of the problem, with sample costs scaling efficiently.
",TfwGtfPkhV,Testing the Feasibility of Linear Programs with Bandit Feedback,https://openreview.net/pdf/a89b112bea8fde3d1e91d41d41e6dd7fdf86aff2.pdf,True
poster,"[{'name': 'Shubhada Agrawal', 'openreview_id': '~Shubhada_Agrawal1', 'affiliation_name': 'Carnegie Mellon University', 'affiliation_domain': 'cmu.edu', 'affiliation_country': 'US'}, {'name': 'Prashanth L. A.', 'openreview_id': '~Prashanth_L_A1', 'affiliation_name': 'Indian Institute of Technology, Madras', 'affiliation_domain': 'iitm.ac.in', 'affiliation_country': 'IN'}, {'name': '', 'openreview_id': '~Siva_Theja_Maguluri1', 'affiliation_name': 'Georgia Institute of Technology', 'affiliation_domain': 'gatech.edu', 'affiliation_country': 'US'}]",ui/indiaml-tracker/public/tracker/icml-2024.json,False,"This paper develops a temporal-difference (TD) algorithm for evaluating policies in average reward reinforcement learning problems, focusing on asymptotic variance as a risk measure.  The algorithm, applicable to both tabular and linear function approximation settings, achieves a finite-time convergence rate of O(1/k) and provides the first sequential estimator for asymptotic variance with provable finite sample guarantees. This work aims to facilitate the development of variance-constrained reinforcement learning algorithms.
",bID9PiBFpT,Policy Evaluation for Variance in Average Reward Reinforcement Learning,https://openreview.net/pdf/3b877b3be936eb628fd438c4713ff612a784fae7.pdf,False
poster,"[{'name': '', 'openreview_id': '~Piyushi_Manupriya1', 'affiliation_name': 'Indian Institute of Technology Hyderabad', 'affiliation_domain': 'iith.ac.in', 'affiliation_country': 'IN'}, {'name': 'Pratik Jawanpuria', 'openreview_id': '~Pratik_Jawanpuria1', 'affiliation_name': 'Microsoft', 'affiliation_domain': 'microsoft.com', 'affiliation_country': 'US'}, {'name': 'Karthik S. Gurumoorthy', 'openreview_id': '~Karthik_S._Gurumoorthy2', 'affiliation_name': 'Walmart Global Tech', 'affiliation_domain': 'walmart.com', 'affiliation_country': 'IN'}, {'name': 'SakethaNath Jagarlapudi', 'openreview_id': '~SakethaNath_Jagarlapudi1', 'affiliation_name': 'Indian Institute of Technology Hyderabad', 'affiliation_domain': 'iith.ac.in', 'affiliation_country': 'IN'}, {'name': '', 'openreview_id': '~Bamdev_Mishra1', 'affiliation_name': 'Microsoft', 'affiliation_domain': 'microsoft.com', 'affiliation_country': 'US'}]",ui/indiaml-tracker/public/tracker/icml-2024.json,True,"This paper introduces novel sparsity-constrained optimal transport (OT) formulations for unbalanced OT (UOT).  It leverages a submodular framework to efficiently optimize transport plans with a structured sparsity pattern.  The authors develop efficient algorithms with theoretical guarantees, demonstrating practical applicability in various domains.
",bfQCO9Vqhk,Submodular framework for structured-sparse optimal transport,https://openreview.net/pdf/15e9e2ce1a2a6304834b144d8443de2478e30aa7.pdf,True
poster,"[{'name': 'Avishek Ghosh', 'openreview_id': '~Avishek_Ghosh2', 'affiliation_name': 'Indian Institute of Technology, Bombay', 'affiliation_domain': 'iitb.ac.in', 'affiliation_country': 'IN'}, {'name': '', 'openreview_id': '~Arya_Mazumdar1', 'affiliation_name': 'University of California, San Diego', 'affiliation_domain': 'ucsd.edu', 'affiliation_country': 'US'}]",ui/indiaml-tracker/public/tracker/icml-2024.json,True,"This paper investigates the agnostic learning of mixed linear regressions.  It demonstrates that the EM and AM algorithms, under specific conditions, can learn optimal solutions for the problem even without a generative model. The key is finding the set of linear functions that minimize a predefined loss function for a given dataset.
",eo88noTbb5,Agnostic Learning of Mixed Linear Regressions with EM and AM Algorithms,https://openreview.net/pdf/17a75d2d4ceb5ac28e380f4e82e1c0df8d09dbb8.pdf,True
poster,"[{'name': 'VIKAS DEEP', 'openreview_id': '~VIKAS_DEEP1', 'affiliation_name': 'Northwestern University', 'affiliation_domain': 'northwestern.edu', 'affiliation_country': 'US'}, {'name': 'Sandeep Kumar Juneja', 'openreview_id': '~Sandeep_Kumar_Juneja1', 'affiliation_name': 'Ashoka University', 'affiliation_domain': 'ashoka.edu.in', 'affiliation_country': 'IN'}]",ui/indiaml-tracker/public/tracker/icml-2024.json,True,"This paper investigates estimating the average treatment effect (ATE) in A/B testing.  It develops asymptotically optimal and computationally efficient adaptive policies for constructing confidence intervals (CIs) for ATE.  The proposed methods minimize the expected sample size while guaranteeing a desired level of precision and confidence.
",eqIGoEoI10,Asymptotically Optimal and Computationally Efficient Average Treatment Effect Estimation in A/B testing,https://openreview.net/pdf/e6a6390164671b94fb6543bf8b3cc2674dbadc9d.pdf,False
poster,"[{'name': 'Utsav Singh', 'openreview_id': '~Utsav_Singh1', 'affiliation_name': 'Indian Institute of Technology, Kanpur', 'affiliation_domain': 'iitk.ac.in', 'affiliation_country': 'IN'}, {'name': 'Wesley A. Suttle', 'openreview_id': '~Wesley_A_Suttle1', 'affiliation_name': 'Army Research Laboratory', 'affiliation_domain': 'army.mil', 'affiliation_country': 'US'}, {'name': 'Brian M. Sadler', 'openreview_id': '~Brian_M._Sadler1', 'affiliation_name': 'University of Texas at Austin', 'affiliation_domain': 'utexas.edu', 'affiliation_country': 'US'}, {'name': '', 'openreview_id': '~Vinay_P_Namboodiri1', 'affiliation_name': 'University of Bath', 'affiliation_domain': 'bath.ac.uk', 'affiliation_country': 'GB'}, {'name': 'Amrit Singh Bedi', 'openreview_id': '~Amrit_Bedi1', 'affiliation_name': 'University of Central Florida', 'affiliation_domain': 'ucf.edu', 'affiliation_country': 'US'}]",ui/indiaml-tracker/public/tracker/icml-2024.json,False,"The paper introduces PIPER, a novel hierarchical reinforcement learning approach.  It aims to address the challenges of non-stationarity and infeasible subgoals by leveraging preference-based learning to create a reward model for relabeling replay buffers.  This approach, replacing human feedback with primitive-in-the-loop feedback using sparse rewards, shows improved performance in sparse-reward robotic tasks compared to existing baselines.
",l6Hef6FVd0,PIPER: Primitive-Informed Preference-based Hierarchical Reinforcement Learning via Hindsight Relabeling,https://openreview.net/pdf/486d2e3f8b1d6cd84cc050e257c70fda5c2f6980.pdf,True
poster,"[{'name': '', 'openreview_id': '~Shiv_Shankar2', 'affiliation_name': 'IIT Bombay', 'affiliation_domain': 'iitb.ac.in', 'affiliation_country': 'IN'}, {'name': '', 'openreview_id': '~Ritwik_Sinha1', 'affiliation_name': 'Unknown', 'affiliation_domain': 'unknown.edu', 'affiliation_country': 'UNK'}, {'name': 'Madalina Fiterau', 'openreview_id': '~Madalina_Fiterau3', 'affiliation_name': 'Department of Computer Science, University of Massachusetts, Amherst', 'affiliation_domain': 'cs.umass.edu', 'affiliation_country': 'US'}]",ui/indiaml-tracker/public/tracker/icml-2024.json,False,"This paper introduces HIFIVE, a variational method for estimating global average treatment effects in online A/B testing.  The method addresses the challenge of fragmented user data across devices, a problem emerging from the decline of identifying user devices and the rise of multi-device usage.  HIFIVE aims to improve the accuracy and robustness of preference estimation for online experimentation under these conditions.
",merZTLSdC9,On Online Experimentation without Device Identifiers,https://openreview.net/pdf/0615d619c3602e2d636f310e2ddca4c631b9613c.pdf,True
poster,"[{'name': 'Gaurav Pandey', 'openreview_id': '~Gaurav_Pandey2', 'affiliation_name': 'International Business Machines', 'affiliation_domain': 'ibm.com', 'affiliation_country': 'US'}, {'name': 'Yatin Nandwani', 'openreview_id': '~Yatin_Nandwani1', 'affiliation_name': 'International Business Machines', 'affiliation_domain': 'ibm.com', 'affiliation_country': 'US'}, {'name': '', 'openreview_id': '~Tahira_Naseem1', 'affiliation_name': 'IBM, International Business Machines', 'affiliation_domain': 'us.ibm.com', 'affiliation_country': 'US'}, {'name': 'Mayank Mishra', 'openreview_id': '~Mayank_Mishra1', 'affiliation_name': 'Massachusetts Institute of Technology', 'affiliation_domain': 'mit.edu', 'affiliation_country': 'US'}, {'name': 'Guangxuan Xu', 'openreview_id': '~Guangxuan_Xu1', 'affiliation_name': 'Red Hat. Inc', 'affiliation_domain': 'redhat.com', 'affiliation_country': 'US'}, {'name': 'Dinesh Raghu', 'openreview_id': '~Dinesh_Raghu1', 'affiliation_name': 'IBM Research - New Delhi', 'affiliation_domain': 'in.ibm.com', 'affiliation_country': 'IN'}, {'name': '', 'openreview_id': '~Sachindra_Joshi1', 'affiliation_name': 'Unknown', 'affiliation_domain': 'unknown.edu', 'affiliation_country': 'UNK'}, {'name': 'Asim Munawar', 'openreview_id': '~Asim_Munawar2', 'affiliation_name': 'International Business Machines', 'affiliation_domain': 'ibm.com', 'affiliation_country': 'US'}, {'name': 'Ramón Fernandez Astudillo', 'openreview_id': '~Ramón_Fernandez_Astudillo1', 'affiliation_name': 'International Business Machines', 'affiliation_domain': 'ibm.com', 'affiliation_country': 'US'}]",ui/indiaml-tracker/public/tracker/icml-2024.json,False,"This research paper introduces BRAIN, a new reinforcement learning from human feedback (RLHF) method for natural language generation.  It aims to improve upon existing distribution matching techniques by reducing gradient variance and generalizing the target distribution using Bayesian methods.  The proposed approach, a bridge between distribution matching and Direct Preference Optimization (DPO), demonstrates superior performance on summarization and Antropic HH tasks compared to previous methods.
",nxzXTLByXO,BRAIn: Bayesian Reward-conditioned Amortized Inference for natural language generation from feedback,https://openreview.net/pdf/adec4b8db2c08af7cf38121b2b60680f89348c2c.pdf,False
poster,"[{'name': 'Lokesh Nagalapatti', 'openreview_id': '~Lokesh_Nagalapatti1', 'affiliation_name': 'Indian Institute of Technology, Bombay', 'affiliation_domain': 'iitb.ac.in', 'affiliation_country': 'IN'}, {'name': 'Avishek Ghosh', 'openreview_id': '~Avishek_Ghosh2', 'affiliation_name': 'Indian Institute of Technology, Bombay', 'affiliation_domain': 'iitb.ac.in', 'affiliation_country': 'IN'}, {'name': 'Sunita Sarawagi', 'openreview_id': '~Sunita_Sarawagi1', 'affiliation_name': 'IIT Bombay', 'affiliation_domain': 'iitb.ac.in', 'affiliation_country': 'IN'}]",ui/indiaml-tracker/public/tracker/icml-2024.json,True,"This paper introduces PairNet, a novel method for estimating individual treatment effects (ITE) from observational data.  PairNet avoids the use of potentially inaccurate pseudo-outcomes, focusing instead on observed outcomes in pairs of examples.  The theoretical analysis and empirical results demonstrate its superior performance compared to existing methods in estimating ITE.
",o5SVr80Rgg,PairNet: Training with Observed Pairs to Estimate Individual Treatment Effect,https://openreview.net/pdf/8542c0b81c30deb10c2d35fd220b4d912812d24a.pdf,True
poster,"[{'name': 'Achintya Nath', 'openreview_id': '~Achintya_Nath1', 'affiliation_name': 'Indian Institute of Technology, Roorkee', 'affiliation_domain': 'iitr.ac.in', 'affiliation_country': 'IO'}, {'name': 'Paritosh Kabra', 'openreview_id': '~Paritosh_Kabra1', 'affiliation_name': 'Indian Institute of Technology, Roorkee', 'affiliation_domain': 'iitr.ac.in', 'affiliation_country': 'IN'}, {'name': 'Ishu Gupta', 'openreview_id': '~Ishu_Gupta1', 'affiliation_name': 'Indian Institute of Technology, Roorkee, Dhirubhai Ambani Institute Of Information and Communication Technology', 'affiliation_domain': 'iitr.ac.in', 'affiliation_country': 'IN'}, {'name': 'Pravendra Singh', 'openreview_id': '~Pravendra_Singh1', 'affiliation_name': 'Indian Institute of Technology, Roorkee', 'affiliation_domain': 'iitr.ac.in', 'affiliation_country': 'IN'}]",ui/indiaml-tracker/public/tracker/icml-2024.json,True,"This paper proposes MS-TIP, a novel approach for pedestrian trajectory prediction that addresses missing data in observed sequences.  MS-TIP leverages transformers for imputation and multi-scale hypergraphs for interaction modeling, aiming to improve prediction accuracy by considering context and interactions at different scales.  The method includes a control point and refinement module for enhanced future trajectory inference.
",s4Hy0L4mml,MS-TIP: Imputation Aware Pedestrian Trajectory Prediction,https://openreview.net/pdf/1d8e4c1deb5aa09684e661e39df6dfe8bba15611.pdf,False
poster,"[{'name': 'Rahul Singh', 'openreview_id': '~Rahul_Singh5', 'affiliation_name': 'Indian Institute of Science', 'affiliation_domain': 'iisc.ac.in', 'affiliation_country': 'IN'}, {'name': 'Akshay Mete', 'openreview_id': '~Akshay_Mete1', 'affiliation_name': 'Texas A&M University - College Station', 'affiliation_domain': 'tamu.edu', 'affiliation_country': 'US'}, {'name': 'Avik Kar', 'openreview_id': '~Avik_Kar1', 'affiliation_name': 'Indian Institute of Science, Indian institute of science, Bangalore', 'affiliation_domain': 'iisc.ac.in', 'affiliation_country': 'IN'}, {'name': '', 'openreview_id': '~Panganamala_Kumar1', 'affiliation_name': 'Texas A&M', 'affiliation_domain': 'tamu.edu', 'affiliation_country': 'US'}]",ui/indiaml-tracker/public/tracker/icml-2024.json,True,"This paper introduces a novel algorithm, PIECE, for the self-tuning regulation problem, which aims to minimize the output variance of a system with an unknown model.  Crucially, the algorithm achieves a logarithmic regret bound for finite time, a significant improvement over existing methods for similar problems.  The proposed PIECE algorithm addresses the often problematic initial transient performance of reinforcement learning algorithms for linear systems by cleverly incorporating techniques for exploration and input clipping.
",tTtSnpH4fc,Finite Time Logarithmic Regret Bounds for Self-Tuning Regulation,https://openreview.net/pdf/a7f969be6c3977786d11395298655bfc29c99967.pdf,True
poster,"[{'name': 'Hiren Madhu', 'openreview_id': '~Hiren_Madhu1', 'affiliation_name': 'Yale University', 'affiliation_domain': 'yale.edu', 'affiliation_country': 'US'}, {'name': 'Sravanthi Gurugubelli', 'openreview_id': '~Sravanthi_Gurugubelli1', 'affiliation_name': 'Indian Institute of Science, Bangalore', 'affiliation_domain': 'iisc.ac.in', 'affiliation_country': 'IN'}, {'name': 'Sundeep Prabhakar Chepuri', 'openreview_id': '~Sundeep_Prabhakar_Chepuri1', 'affiliation_name': 'Indian Institute of Science', 'affiliation_domain': 'iisc.ac.in', 'affiliation_country': 'IN'}]",ui/indiaml-tracker/public/tracker/icml-2024.json,True,"This paper introduces simplicial scattering networks (SSNs), a parameter-free model for learning task-agnostic features from simplicial complex data.  Unlike existing simplicial neural networks, SSNs avoid the high training complexity and reliance on task-specific labels by employing a scattering transform.  The proposed method uses random walk matrices to extract high-frequency information, demonstrating superior performance on various tasks like node classification and graph classification compared to existing simplicial or graph neural networks.
",wmljUnbjy6,Unsupervised Parameter-free Simplicial Representation Learning with Scattering Transforms,https://openreview.net/pdf/c86519c899c3ac54e7702b9fdcbb438886ce2c8c.pdf,False
