accept_type,author_list,filename,majority_authors_from_india,paper_content,paper_id,paper_title,pdf_url,top_author_from_india
poster,"[{'name': 'Somesh Kumar Singh', 'openreview_id': '~Somesh_Kumar_Singh2', 'affiliation_name': 'Indraprastha Institute of Information Technology, Delhi', 'affiliation_domain': 'iiitd.ac.in', 'affiliation_country': 'IN'}, {'name': 'Harini S I', 'openreview_id': '~Harini_S_I1', 'affiliation_name': 'Adobe Systems', 'affiliation_domain': 'adobe.com', 'affiliation_country': 'IN'}, {'name': 'Yaman Kumar Singla', 'openreview_id': '~Yaman_Kumar_Singla1', 'affiliation_name': 'Adobe ', 'affiliation_domain': 'adobe.com', 'affiliation_country': 'IN'}, {'name': '', 'openreview_id': '~Changyou_Chen1', 'affiliation_name': 'State University of New York, Buffalo', 'affiliation_domain': 'buffalo.edu', 'affiliation_country': 'US'}, {'name': '', 'openreview_id': '~Rajiv_Ratn_Shah1', 'affiliation_name': 'Indraprastha Institute of Information Technology, Delhi', 'affiliation_domain': 'iiitd.ac.in', 'affiliation_country': 'IN'}, {'name': 'Veeky Baths', 'openreview_id': '~Veeky_Baths1', 'affiliation_name': 'UNK', 'affiliation_domain': 'UNK', 'affiliation_country': 'UNK'}, {'name': '', 'openreview_id': '~Balaji_Krishnamurthy1', 'affiliation_name': 'Adobe Systems', 'affiliation_domain': 'adobe.com', 'affiliation_country': 'IN'}]",ui/indiaml-tracker/public/tracker/iclr-2025.json,True,"This research investigates improving vision-language model (VLM) content understanding by incorporating receiver behavior, such as likes and comments.  The authors demonstrate that training VLMs on these behaviors enhances VLM performance across various content understanding tasks.  This approach leverages readily available, publicly-sourced receiver behavior data, offering a performance boost and a potential free resource for VLM improvement.
",ff2V3UR9sC,Teaching Human Behavior Improves Content Understanding Abilities Of VLMs,https://openreview.net/pdf/c838bbe0a12f56b1fde9d76191b41894a12cd638.pdf,True
poster,"[{'name': 'Arhaan Ahmad', 'openreview_id': '~Arhaan_Ahmad1', 'affiliation_name': 'Indian Institute of Technology, Bombay', 'affiliation_domain': 'iitb.ac.in', 'affiliation_country': 'IN'}, {'name': 'Tanay Vineet Tayal', 'openreview_id': '~Tanay_Vineet_Tayal1', 'affiliation_name': 'Indian Institute of Technology, Bombay, Dhirubhai Ambani Institute Of Information and Communication Technology', 'affiliation_domain': 'iitb.ac.in', 'affiliation_country': 'IN'}, {'name': 'Ashutosh Gupta', 'openreview_id': '~Ashutosh_Gupta2', 'affiliation_name': 'IIT Bombay', 'affiliation_domain': 'iitb.ac.in', 'affiliation_country': 'IN'}, {'name': '', 'openreview_id': '~S._Akshay1', 'affiliation_name': 'Indian Institute of Technology Bombay, Indian Institute of Technology, Bombay', 'affiliation_domain': 'cse.iitb.ac.in', 'affiliation_country': 'IN'}]",ui/indiaml-tracker/public/tracker/iclr-2025.json,True,"This paper develops a formal verification framework for analyzing feature sensitivity in additive decision tree ensembles, considering the confidence of the model's output.  It demonstrates the theoretical (NP-)hardness of this problem and provides a pseudo-Boolean constraint encoding for a tunable sensitivity analysis algorithm, balancing accuracy and runtime.  The authors evaluate their approach on existing GBDT benchmarks, showing improved performance compared to existing methods.
",h0vC0fm1q7,Sensitivity Verification for Additive Decision Tree Ensembles,https://openreview.net/pdf/0baccd0626487637d58895c5bf4daa1f701f0d6f.pdf,True
poster,"[{'name': 'Aditya Ramesh', 'openreview_id': '~Aditya_Ramesh3', 'affiliation_name': 'Fujitsu Research and Development Center Co. Ltm.', 'affiliation_domain': 'fujitsu.com', 'affiliation_country': 'IN'}, {'name': 'Shivam Bhardwaj', 'openreview_id': '~Shivam_Bhardwaj1', 'affiliation_name': 'Fujitsu Research and Development Center Co. Ltm.', 'affiliation_domain': 'fujitsu.com', 'affiliation_country': 'IN'}, {'name': 'Aditya Saibewar', 'openreview_id': '~Aditya_Saibewar1', 'affiliation_name': 'Fujitsu Research and Development Center Co. Ltm.', 'affiliation_domain': 'fujitsu.com', 'affiliation_country': 'IN'}, {'name': '', 'openreview_id': '~Manohar_Kaul1', 'affiliation_name': 'Fujitsu Research and Development Center Co. Ltm.', 'affiliation_domain': 'fujitsu.com', 'affiliation_country': 'IN'}]",ui/indiaml-tracker/public/tracker/iclr-2025.json,True,"This paper introduces a novel jailbreak attack on large language models (LLMs).  It leverages a multi-armed bandit (MAB) approach to create sequential context-switching queries (CSQs) that systematically weaken the model's safety boundaries.  The authors demonstrate significantly improved attack success rates compared to existing methods.
",jCDF7G3LpF,EFFICIENT JAILBREAK ATTACK SEQUENCES ON LARGE LANGUAGE MODELS VIA MULTI-ARMED BANDIT-BASED CONTEXT SWITCHING,https://openreview.net/pdf/bc16e7d0bc5f4d8c4b1a1d6e943556544f77ff36.pdf,True
spotlight,"[{'name': 'Angelika Romanou', 'openreview_id': '~Angelika_Romanou1', 'affiliation_name': 'Swiss Federal Institute of Technology Lausanne', 'affiliation_domain': 'epfl.ch', 'affiliation_country': 'CH'}, {'name': 'Negar Foroutan', 'openreview_id': '~Negar_Foroutan1', 'affiliation_name': 'School of Computer and Communication Sciences, EPFL - EPF Lausanne', 'affiliation_domain': 'ic.epfl.ch', 'affiliation_country': 'CH'}, {'name': 'Anna Sotnikova', 'openreview_id': '~Anna_Sotnikova1', 'affiliation_name': 'EPFL - EPF Lausanne', 'affiliation_domain': 'epfl.ch', 'affiliation_country': 'CH'}, {'name': 'Sree Harsha Nelaturu', 'openreview_id': '~Sree_Harsha_Nelaturu1', 'affiliation_name': 'CISPA Helmholtz Center for Information Security', 'affiliation_domain': 'cispa.de', 'affiliation_country': 'DE'}, {'name': 'Shivalika Singh', 'openreview_id': '~Shivalika_Singh1', 'affiliation_name': 'Cohere For AI', 'affiliation_domain': 'UNK', 'affiliation_country': 'CA'}, {'name': 'Rishabh Maheshwary', 'openreview_id': '~Rishabh_Maheshwary2', 'affiliation_name': 'ServiceNow', 'affiliation_domain': 'servicenow.com', 'affiliation_country': 'IN'}, {'name': 'Micol Altomare', 'openreview_id': '~Micol_Altomare1', 'affiliation_name': 'University of Toronto', 'affiliation_domain': 'utoronto.ca', 'affiliation_country': 'CA'}, {'name': 'Zeming Chen', 'openreview_id': '~Zeming_Chen1', 'affiliation_name': 'Swiss Federal Institute of Technology Lausanne (EPFL)', 'affiliation_domain': 'epfl.ch', 'affiliation_country': 'CH'}, {'name': 'Mohamed A. Haggag', 'openreview_id': '~Mohamed_A._Haggag1', 'affiliation_name': 'Georgia Institute of Technology', 'affiliation_domain': 'UNK', 'affiliation_country': 'US'}, {'name': 'Snegha A', 'openreview_id': '~Snegha_A1', 'affiliation_name': 'Indian Institute of Technology, Bombay', 'affiliation_domain': 'iitb.ac.in', 'affiliation_country': 'IN'}, {'name': 'Alfonso Amayuelas', 'openreview_id': '~Alfonso_Amayuelas2', 'affiliation_name': 'University of California, Santa Barbara', 'affiliation_domain': 'ucsb.edu', 'affiliation_country': 'US'}, {'name': 'Azril Hafizi Amirudin', 'openreview_id': '~Azril_Hafizi_Amirudin1', 'affiliation_name': 'University of the People', 'affiliation_domain': 'uopeople.edu', 'affiliation_country': 'US'}, {'name': 'Danylo Boiko', 'openreview_id': '~Danylo_Boiko1', 'affiliation_name': 'Taras Shevchenko National University of Kyiv', 'affiliation_domain': 'knu.ua', 'affiliation_country': 'UA'}, {'name': 'Michael Chang', 'openreview_id': '~Michael_Chang2', 'affiliation_name': 'Trulioo', 'affiliation_domain': 'trulioo.com', 'affiliation_country': 'CA'}, {'name': 'Jenny Chim', 'openreview_id': '~Jenny_Chim1', 'affiliation_name': 'UNK', 'affiliation_domain': 'UNK', 'affiliation_country': 'UNK'}, {'name': 'Gal Cohen', 'openreview_id': '~Gal_Cohen2', 'affiliation_name': 'University of Toronto', 'affiliation_domain': 'utoronto.ca', 'affiliation_country': 'CA'}, {'name': 'Aditya Kumar Dalmia', 'openreview_id': '~Aditya_Kumar_Dalmia1', 'affiliation_name': 'NeuralSpace, Inc.', 'affiliation_domain': 'neuralspace.ai', 'affiliation_country': 'IN'}, {'name': 'Abraham Diress', 'openreview_id': '~Abraham_Diress1', 'affiliation_name': 'UNK', 'affiliation_domain': 'UNK', 'affiliation_country': 'UNK'}, {'name': 'Sharad Duwal', 'openreview_id': '~Sharad_Duwal1', 'affiliation_name': 'Fatima Fellowship', 'affiliation_domain': 'fatimafellowship.com', 'affiliation_country': 'US'}, {'name': 'Daniil Dzenhaliou', 'openreview_id': '~Daniil_Dzenhaliou1', 'affiliation_name': 'EPFL - EPF Lausanne', 'affiliation_domain': 'epfl.ch', 'affiliation_country': 'CH'}, {'name': 'Daniel Fernando Erazo Florez', 'openreview_id': '~Daniel_Fernando_Erazo_Florez1', 'affiliation_name': 'Universidad del Valle del Cauca', 'affiliation_domain': 'univalle.edu.co', 'affiliation_country': 'CO'}, {'name': 'Fabian Farestam', 'openreview_id': '~Fabian_Farestam1', 'affiliation_name': 'ETHZ - ETH Zurich', 'affiliation_domain': 'ethz.ch', 'affiliation_country': 'CH'}, {'name': 'Joseph Marvin Imperial', 'openreview_id': '~Joseph_Marvin_Imperial1', 'affiliation_name': 'University of Bath', 'affiliation_domain': 'bath.ac.uk', 'affiliation_country': 'GB'}, {'name': 'Shayekh Bin Islam', 'openreview_id': '~Shayekh_Bin_Islam1', 'affiliation_name': 'Qatar Computing Research Institute', 'affiliation_domain': 'qcri.org', 'affiliation_country': 'QA'}, {'name': 'Perttu Isotalo', 'openreview_id': '~Perttu_Isotalo1', 'affiliation_name': 'Turing College', 'affiliation_domain': 'turingcollege.com', 'affiliation_country': 'LT'}, {'name': 'Maral Jabbarishiviari', 'openreview_id': '~Maral_Jabbarishiviari1', 'affiliation_name': 'UNK', 'affiliation_domain': 'UNK', 'affiliation_country': 'UNK'}, {'name': 'Börje F. Karlsson', 'openreview_id': '~Börje_F._Karlsson1', 'affiliation_name': 'Beijing Academy of Artificial Intelligence (BAAI)', 'affiliation_domain': 'baai.ac.cn', 'affiliation_country': 'CN'}, {'name': 'Eldar Khalilov', 'openreview_id': '~Eldar_Khalilov1', 'affiliation_name': 'UNK', 'affiliation_domain': 'UNK', 'affiliation_country': 'UNK'}, {'name': '', 'openreview_id': '~Christopher_Klamm1', 'affiliation_name': 'Universität Mannheim', 'affiliation_domain': 'uni-mannheim.de', 'affiliation_country': 'DE'}, {'name': 'Fajri Koto', 'openreview_id': '~Fajri_Koto1', 'affiliation_name': 'Mohamed bin Zayed University of Artificial Intelligence', 'affiliation_domain': 'mbzuai.ac.ae', 'affiliation_country': 'AE'}, {'name': 'Dominik Krzemiński', 'openreview_id': '~Dominik_Krzemiński1', 'affiliation_name': 'UNK', 'affiliation_domain': 'UNK', 'affiliation_country': 'UNK'}, {'name': 'Gabriel Adriano de Melo', 'openreview_id': '~Gabriel_Adriano_de_Melo1', 'affiliation_name': 'Instituto Tecnológico de Aeronáutica', 'affiliation_domain': 'ita.br', 'affiliation_country': 'BR'}, {'name': 'Syrielle Montariol', 'openreview_id': '~Syrielle_Montariol1', 'affiliation_name': 'EPFL - EPF Lausanne', 'affiliation_domain': 'epfl.ch', 'affiliation_country': 'CH'}, {'name': 'Yiyang Nan', 'openreview_id': '~Yiyang_Nan1', 'affiliation_name': 'UNK', 'affiliation_domain': 'UNK', 'affiliation_country': 'UNK'}, {'name': 'Joel Niklaus', 'openreview_id': '~Joel_Niklaus1', 'affiliation_name': 'Harvey', 'affiliation_domain': 'harvey.ai', 'affiliation_country': 'US'}, {'name': 'Jekaterina Novikova', 'openreview_id': '~Jekaterina_Novikova1', 'affiliation_name': 'Winterlight Labs', 'affiliation_domain': 'winterlightlabs.com', 'affiliation_country': 'CA'}, {'name': 'Johan Obando-Ceron', 'openreview_id': '~Johan_Samir_Obando_Ceron1', 'affiliation_name': 'Mila - Quebec AI Institute, Université de Montréal', 'affiliation_domain': 'mila.umontreal.ca', 'affiliation_country': 'CA'}, {'name': 'Debjit Paul', 'openreview_id': '~Debjit_Paul2', 'affiliation_name': 'EPFL - EPF Lausanne', 'affiliation_domain': 'epfl.ch', 'affiliation_country': 'CH'}, {'name': 'Jebish Purbey', 'openreview_id': '~Jebish_Purbey1', 'affiliation_name': 'Tribhuvan University', 'affiliation_domain': 'pcampus.edu.np', 'affiliation_country': 'NP'}, {'name': 'Swati Rajwal', 'openreview_id': '~Swati_Rajwal2', 'affiliation_name': 'Emory University', 'affiliation_domain': 'emory.edu', 'affiliation_country': 'US'}, {'name': 'Selvan Sunitha Ravi', 'openreview_id': '~Selvan_Sunitha_Ravi1', 'affiliation_name': 'UNK', 'affiliation_domain': 'UNK', 'affiliation_country': 'UNK'}, {'name': 'Sara Rydell', 'openreview_id': '~Sara_Rydell1', 'affiliation_name': 'KTH Royal Institute of Technology', 'affiliation_domain': 'kth.se', 'affiliation_country': 'SE'}, {'name': 'Roshan Santhosh', 'openreview_id': '~Roshan_Santhosh1', 'affiliation_name': 'Adobe Systems', 'affiliation_domain': 'adobe.com', 'affiliation_country': 'US'}, {'name': 'Drishti Sharma', 'openreview_id': '~Drishti_Sharma2', 'affiliation_name': 'Cohere', 'affiliation_domain': 'cohere.ai', 'affiliation_country': 'IN'}, {'name': 'Marjana Prifti Skenduli', 'openreview_id': '~Marjana_Prifti_Skenduli1', 'affiliation_name': 'University of New York Tirana', 'affiliation_domain': 'unyt.edu.al', 'affiliation_country': 'AL'}, {'name': 'Arshia Soltani Moakhar', 'openreview_id': '~Arshia_Soltani_Moakhar1', 'affiliation_name': 'University of Maryland, College Park', 'affiliation_domain': 'umd.edu', 'affiliation_country': 'US'}, {'name': 'Bardia soltani moakhar', 'openreview_id': '~Bardia_soltani_moakhar1', 'affiliation_name': 'Sharif University of Technology', 'affiliation_domain': 'sharif.ir', 'affiliation_country': 'IR'}, {'name': 'Ayush Kumar Tarun', 'openreview_id': '~Ayush_Kumar_Tarun1', 'affiliation_name': 'EPFL - EPF Lausanne', 'affiliation_domain': 'epfl.ch', 'affiliation_country': 'CH'}, {'name': 'Azmine Toushik Wasi', 'openreview_id': '~Azmine_Toushik_Wasi1', 'affiliation_name': 'Shahjalal University of Science and Technology', 'affiliation_domain': 'sust.edu', 'affiliation_country': 'BD'}, {'name': 'Thenuka Ovin Weerasinghe', 'openreview_id': '~Thenuka_Ovin_Weerasinghe1', 'affiliation_name': 'UNK', 'affiliation_domain': 'UNK', 'affiliation_country': 'UNK'}, {'name': 'Serhan Yilmaz', 'openreview_id': '~Serhan_Yilmaz1', 'affiliation_name': 'Technische Universität Darmstadt', 'affiliation_domain': 'tu-darmstadt.de', 'affiliation_country': 'DE'}, {'name': 'Mike Zhang', 'openreview_id': '~Mike_Zhang1', 'affiliation_name': 'Aalborg University (Copenhagen)', 'affiliation_domain': 'cs.aau.dk', 'affiliation_country': 'DK'}, {'name': 'Imanol Schlag', 'openreview_id': '~Imanol_Schlag3', 'affiliation_name': 'ETHZ - ETH Zurich', 'affiliation_domain': 'ethz.ch', 'affiliation_country': 'CH'}, {'name': 'Marzieh Fadaee', 'openreview_id': '~Marzieh_Fadaee2', 'affiliation_name': 'Cohere For AI', 'affiliation_domain': 'cohere.com', 'affiliation_country': 'NL'}, {'name': 'Sara Hooker', 'openreview_id': '~Sara_Hooker2', 'affiliation_name': 'Cohere For AI', 'affiliation_domain': 'cohere.com', 'affiliation_country': 'US'}, {'name': '', 'openreview_id': '~Antoine_Bosselut1', 'affiliation_name': 'Swiss Federal Institute of Technology Lausanne', 'affiliation_domain': 'epfl.ch', 'affiliation_country': 'CH'}]",ui/indiaml-tracker/public/tracker/iclr-2025.json,False,"This paper aims to develop a comprehensive evaluation resource, INCLUDE, for multilingual large language models (LLMs).  INCLUDE  will assess LLM performance across 44 languages by using a knowledge- and reasoning-centric benchmark based on regional exam questions.  The resource is designed to address the lack of high-quality evaluation data in languages other than English, promoting fairer and more equitable LLM deployment globally.
",k3gCieTXeY,INCLUDE: Evaluating Multilingual Language Understanding with Regional Knowledge,https://openreview.net/pdf/4735757bbe8999ee1c4990094d9326caa8c46a64.pdf,False
poster,"[{'name': 'Arkaprava Majumdar', 'openreview_id': '~Arkaprava_Majumdar1', 'affiliation_name': 'Indian Institute of Technology, Hyderabad', 'affiliation_domain': 'iith.ac.in', 'affiliation_country': 'IN'}, {'name': 'M Anand Krishna', 'openreview_id': '~M_Anand_Krishna1', 'affiliation_name': 'Indian Institute of Technology, Hyderabad, Dhirubhai Ambani Institute Of Information and Communication Technology', 'affiliation_domain': 'iith.ac.in', 'affiliation_country': 'IN'}, {'name': 'P. K. Srijith', 'openreview_id': '~P._K._Srijith1', 'affiliation_name': 'Indian Institute of Technology Hyderabad', 'affiliation_domain': 'iith.ac.in', 'affiliation_country': 'IN'}]",ui/indiaml-tracker/public/tracker/iclr-2025.json,True,"This paper introduces a novel deep learning method, the neural wave equation, for sequence labeling tasks involving irregularly sampled data.  It aims to improve upon existing neural ODE-based architectures by allowing continuous modeling of depth and time, thereby enhancing flexibility and adaptability to varying data complexities.  The authors demonstrate the method's superior performance on several sequence labeling problems compared to previous models.
",kbeX97jExm,Neural Wave Equation for Irregularly Sampled Sequence Data,https://openreview.net/pdf/8ed140ad99d8ff52315acf85732ba20a69b155a7.pdf,True
poster,"[{'name': 'Lokesh Nagalapatti', 'openreview_id': '~Lokesh_Nagalapatti1', 'affiliation_name': 'Indian Institute of Technology, Bombay', 'affiliation_domain': 'iitb.ac.in', 'affiliation_country': 'IN'}, {'name': 'Ashutosh Srivastava', 'openreview_id': '~Ashutosh_Srivastava2', 'affiliation_name': 'International Institute of Information Technology, Hyderabad, International Institute of Information Technology Hyderabad', 'affiliation_domain': 'students.iiit.ac.in', 'affiliation_country': 'IN'}, {'name': 'Sunita Sarawagi', 'openreview_id': '~Sunita_Sarawagi1', 'affiliation_name': 'IIT Bombay', 'affiliation_domain': 'iitb.ac.in', 'affiliation_country': 'IN'}, {'name': 'Amit Sharma', 'openreview_id': '~Amit_Sharma3', 'affiliation_name': 'Microsoft Research', 'affiliation_domain': 'microsoft.com', 'affiliation_country': 'IN'}]",ui/indiaml-tracker/public/tracker/iclr-2025.json,True,"This paper introduces In-Distribution Interventions (IDI), a novel algorithm for robustly diagnosing root causes of anomalies in complex systems.  IDI predicts root causes by considering both anomalous node values and the effect of intervening on these values to resolve the anomaly, avoiding the unreliability of counterfactual estimates from historical data.  Experiments on synthetic and real datasets demonstrate IDI's superior accuracy compared to existing methods in identifying true root causes.
",l11DZY5Nxu,Robust Root Cause Diagnosis using In-Distribution Interventions,https://openreview.net/pdf/704fab6788807803612ad2b12344cc35a2a74913.pdf,True
poster,"[{'name': 'Sujoy Bhore', 'openreview_id': '~Sujoy_Bhore1', 'affiliation_name': 'Indian Institute of Technology Bombay, Indian Institute of Technology, Bombay', 'affiliation_domain': 'cse.iitb.ac.in', 'affiliation_country': 'IN'}, {'name': 'Devdan Dey', 'openreview_id': '~Devdan_Dey1', 'affiliation_name': 'Indian Institute of Technology, Bombay', 'affiliation_domain': 'iitb.ac.in', 'affiliation_country': 'IN'}, {'name': 'Satyam Singh', 'openreview_id': '~Satyam_Singh1', 'affiliation_name': 'Indian Institute of Technology Bombay, Indian Institute of Technology, Bombay', 'affiliation_domain': 'cse.iitb.ac.in', 'affiliation_country': 'IN'}]",ui/indiaml-tracker/public/tracker/iclr-2025.json,True,,nNiWRRj6r9,ONLINE EPSILON NET & PIERCING SET FOR GEOMETRIC CONCEPTS,https://openreview.net/pdf/696d482ba820dd1fb2c61d652aea1b70e1287ef9.pdf,True
oral,"[{'name': 'Esben Kran', 'openreview_id': '~Esben_Kran1', 'affiliation_name': 'Apart Research', 'affiliation_domain': 'apartresearch.com', 'affiliation_country': 'US'}, {'name': 'Hieu Minh Nguyen', 'openreview_id': '~Hieu_Minh_Nguyen2', 'affiliation_name': 'University of Science and Technology of Hanoi', 'affiliation_domain': 'usth.edu.vn', 'affiliation_country': 'VN'}, {'name': 'Akash Kundu', 'openreview_id': '~Akash_Kundu2', 'affiliation_name': 'Heritage Institute of Technology', 'affiliation_domain': 'heritageit.edu', 'affiliation_country': 'IN'}, {'name': 'Sami Jawhar', 'openreview_id': '~Sami_Jawhar1', 'affiliation_name': 'METR', 'affiliation_domain': 'metr.org', 'affiliation_country': 'US'}, {'name': 'Jinsuk Park', 'openreview_id': '~Jinsuk_Park1', 'affiliation_name': 'Independent', 'affiliation_domain': 'UNK', 'affiliation_country': 'US'}, {'name': 'Mateusz Maria Jurewicz', 'openreview_id': '~Mateusz_Maria_Jurewicz1', 'affiliation_name': 'Independent', 'affiliation_domain': 'UNK', 'affiliation_country': 'US'}]",ui/indiaml-tracker/public/tracker/iclr-2025.json,False,"This paper introduces DarkBench, a benchmark to identify and quantify ""dark patterns""—manipulative design techniques—in large language models (LLMs).  The benchmark evaluates six categories of dark patterns in responses from 14 LLMs from leading companies.  The study aims to highlight the prevalence of these patterns and encourage developers to mitigate their use in AI systems, promoting ethical AI development.
",odjMSBSWRt,DarkBench: Benchmarking Dark Patterns in Large Language Models,https://openreview.net/pdf/66d66215ed6e8821cf14e0c9c0e83be089660c40.pdf,False
poster,"[{'name': 'Peihao Wang', 'openreview_id': '~Peihao_Wang1', 'affiliation_name': 'University of Texas, Austin', 'affiliation_domain': 'utexas.edu', 'affiliation_country': 'US'}, {'name': 'Ruisi Cai', 'openreview_id': '~Ruisi_Cai1', 'affiliation_name': 'University of Texas at Austin', 'affiliation_domain': 'utexas.edu', 'affiliation_country': 'US'}, {'name': 'Jiajun Zhu', 'openreview_id': '~Jiajun_Zhu1', 'affiliation_name': 'Zhejiang University', 'affiliation_domain': 'zju.edu.cn', 'affiliation_country': 'CN'}, {'name': 'Pragya Srivastava', 'openreview_id': '~Pragya_Srivastava1', 'affiliation_name': 'Google DeepMind', 'affiliation_domain': 'google.com', 'affiliation_country': 'IN'}, {'name': 'Zhangyang Wang', 'openreview_id': '~Zhangyang_Wang1', 'affiliation_name': 'University of Texas at Austin', 'affiliation_domain': 'utexas.edu', 'affiliation_country': 'US'}, {'name': 'Pan Li', 'openreview_id': '~Pan_Li2', 'affiliation_name': 'Georgia Institute of Technology', 'affiliation_domain': 'gatech.edu', 'affiliation_country': 'US'}]",ui/indiaml-tracker/public/tracker/iclr-2025.json,False,"This paper investigates the limitations of State Space Models (SSMs) related to recency bias and over-smoothing.  It argues that these inherent limitations hinder scalability.  The authors propose a polarization technique to address these issues and improve long-range associative recall accuracy in SSMs.
",pymXpl4qvi,Understanding and Mitigating Bottlenecks of State Space Models through the Lens of Recency and Over-smoothing,https://openreview.net/pdf/982acd7979eff95835985d1c18fb057152350bf1.pdf,False
poster,"[{'name': 'Kartik Thakral', 'openreview_id': '~Kartik_Thakral1', 'affiliation_name': 'Indian Institute of Technology Jodhpur, India', 'affiliation_domain': 'iitj.ac.in', 'affiliation_country': 'IN'}, {'name': 'Rishabh Ranjan', 'openreview_id': '~Rishabh_Ranjan4', 'affiliation_name': 'Indian Institute of Technology Jodhpur, India', 'affiliation_domain': 'iitj.ac.in', 'affiliation_country': 'IN'}, {'name': 'Akanksha Singh', 'openreview_id': '~Akanksha_Singh1', 'affiliation_name': 'Indian Institute of Technology, Madras', 'affiliation_domain': 'iitm.ac.in', 'affiliation_country': 'IN'}, {'name': 'Akshat Jain', 'openreview_id': '~Akshat_Jain2', 'affiliation_name': 'IIT Jodhpur', 'affiliation_domain': 'iitj.ac.in', 'affiliation_country': 'IN'}, {'name': '', 'openreview_id': '~Mayank_Vatsa1', 'affiliation_name': 'Indian Institute of Technology Jodhpur, India', 'affiliation_domain': 'iitj.ac.in', 'affiliation_country': 'IN'}, {'name': 'Richa Singh', 'openreview_id': '~Richa_Singh1', 'affiliation_name': 'Indian Institute of Technology Jodhpur, India', 'affiliation_domain': 'iitj.ac.in', 'affiliation_country': 'IN'}]",ui/indiaml-tracker/public/tracker/iclr-2025.json,True,"The paper introduces ILLUSION, a large-scale, multi-modal deepfake dataset.  It comprises 1.3 million samples spanning audio-visual forgeries, 26 languages, and various manipulation protocols to address the limitations of existing datasets.  The goal is to create a dataset robust enough to evaluate and advance deepfake detection research, bridging the gap between synthetic and real-world complexities.
",qnlG3zPQUy,"ILLUSION: Unveiling Truth with a Comprehensive Multi-Modal, Multi-Lingual Deepfake Dataset",https://openreview.net/pdf/b4b0f39d84d66fbd58c0ce677e7f47db34c37ab8.pdf,True
